CAPEC-ID,Name,Attack Description,Security Objective,Technical Impact,
CAPEC-26,Leveraging Race Conditions,"In CAPEC-26, an attacker targets a race condition that arises when multiple processes access and manipulate the same resource concurrently and the outcome of execution depends on the specific order in which those accesses occur. The adversary begins by exploring the system to determine their level of access, then experiments by gaining access to a shared resource and modifying it so that the changed value is later used during normal execution. The attacker then exploits the concurrent access by timing their modification to occur just before another process uses the resource, thereby “running the race” and altering the intended execution flow. This attack requires that the adversary be able to modify the targeted resource and possess medium-level knowledge of concurrent processing and synchronization techniques. When successful, the attack can lead to confidentiality violations through improper access control or privilege gain, and integrity violations through unauthorized data modification, with the overall likelihood of exploit rated as medium. A documented example is the race condition in the Net Direct client for Linux prior to version 6.0.5 on the Nortel Application Switch 2424, VPN 3050/3070, and SSL VPN Module 1000, where local users exploited a world-writable /tmp directory to replace a file in /tmp/NetClient/client, causing arbitrary code to execute when another user ran the client.","Confidentiality, Access Control, Authorization, Integrity","Gain Privileges, Modify Data",
CAPEC-37,Retrieve Embedded Sensitive Data,"In CAPEC-37, an adversary examines a target system to locate sensitive data that has been embedded within the system—such as keys, credentials, or account numbers—and uses this embedded information to facilitate further attacks. The attacker begins by identifying client components (which may include hardware‐integrated firmware or storage) that contain embedded data, then extracts those components (for example by removing storage media or dumping firmware). The adversary then applies techniques such as reverse‐engineering, decoding compressed or encoded data, or analyzing hardware registers to retrieve the hidden information. The prerequisites are that the valuable data is present and embedded (especially in hardware or firmware) and that it is unprotected or poorly protected, such that reverse engineering or decoding is feasible. The attacker must have medium skill—familiarity with code structure, debugging or reverse engineering hardware/firmware—and resources that may include physical access to extract components, hex editors, simulators or extraction tools. If successful, the attack compromises confidentiality by reading data, integrity by modifying data, authorization by gaining privileges or bypassing access control, and access protections by bypassing control mechanisms.","Confidentiality, Integrity, Access Control, Authorization","
Read Data, Modify Data, Gain Privileges",
CAPEC-74,Manipulating State,"In CAPEC-74, an adversary manipulates state information maintained by the target software or causes a state transition in hardware, leading the system to later use this tainted state and execute in an unintended manner. State management is critical to correct system behavior, and improper exposure or control of state enables an attacker to modify execution flow, elevate privilege, perform unauthorized operations, or otherwise induce system behavior beneficial to the adversary. The attack unfolds as the adversary first explores how state is managed and where it resides, then experiments by altering state values or forcing specific state transitions to observe their effects, and finally exploits these findings to perform illegitimate actions. This attack is possible when state is maintained in locations that an adversary can influence, or when hardware contains a faulty finite state machine whose undefined states can be triggered to cause denial-of-service conditions or exposure of secure data. Medium-level skill is required to understand and meaningfully manipulate state or state transitions, and the adversary typically uses tampering or input-modification tools to assist in crafting the necessary interactions. CAPEC rates the likelihood of attack as medium and the typical severity as high. A representative example describes how an authentication decision stored in a modifiable location can be altered to gain illegitimate access, illustrating how manipulating state directly undermines system trust assumptions.","CWE-372, CWE-315, CWE-353, CWE-693, CWE-1245, CWE-1253, CWE-1265, CWE-1271","Confidentiality, Access Control, Authorization, Integrity, Availability","Gain Privileges, Modify Data, Unreliable Execution"
CAPEC-97,"
Cryptanalysis","In CAPEC-97, an adversary studies and exploits weaknesses in a cryptographic algorithm—or in how that algorithm is applied—to decipher ciphertext without knowledge of the secret key. The attacker may aim for a total break (discovering the secret key), global deduction (finding an equivalent encryption/decryption method that does not require the key), information deduction (gaining previously unknown plaintext or ciphertext details), or distinguishing the ciphertext from random data. Although the core algorithm may be secure, incorrect application or implementation flaws can allow cryptanalysis to succeed. The likelihood of this attack is low, but the typical severity is rated very high.","
Confidentiality","
Read Data",
CAPEC-113,Interface Manipulation,"In CAPEC-113, an adversary manipulates the use or processing of a hardware or system interface so that the system implementing that interface executes functionality in an unintended way or bypasses access control protections. The attacker forces unexpected or non-standard interactions with the interface—such as a control, debug, or reset interface on an SoC—causing the integrating system to misinterpret commands or expose sensitive behavior. This attack becomes possible when the system exposes interface operations that an adversary can identify and control, which may require reverse-engineering the interface or decrypting or de-obfuscating communication exchanges to understand how the system interprets interface commands. Once the interface behavior is understood, the attacker crafts or manipulates interface requests using available tools, enabling unauthorized operations. Resource needs vary with the interface but may include man-in-the-middle tooling, protocol analyzers, or custom scripts capable of generating or modifying interface traffic. Successful exploitation allows the adversary to bypass access control or trigger unintended functionality, with CAPEC rating the likelihood as medium and typical severity as medium. A hardware-relevant example included in the CAPEC entry describes SoC components that contain insufficient identifiers, enabling an attacker to reset the device at will or read sensitive data through unintended interface manipulation.",,,
CAPEC-114,Authentication Abuse,"In CAPEC-114, an attacker obtains unauthorized access to a device, service, or application by leveraging inherent weaknesses in the authentication mechanism or exploiting flaws in its implementation. The adversary may know how the authentication scheme works (for example default credentials, weak schemes) or may exploit an implementation error so that a carefully-controlled sequence of events causes the mechanism to grant access to the attacker despite functioning nominally. To conduct the attack, the adversary often explores the authentication process to identify weak points (knowledge or implementation defects) and then experiments with sequences of inputs or timing to exploit the flaw. When successful, the attacker gains unauthorized access, potentially bypassing intended access controls or privileges, with the typical severity rated as high and the likelihood rated as medium. Example scenarios include devices or systems where the authentication decision can be manipulated or replayed, or where default or weak credentials allow access to system functions or data.",,,
CAPEC-116,Excavation,"In CAPEC-116, an adversary probes a target system by issuing normal, malformed, or non-standard inputs in order to extract information that the system inadvertently reveals, such as error messages, configuration details, file paths, or other data that can be used to inform later attacks. The attacker interacts with the system through any accessible interface or communication channel and may employ tools such as fuzzers or proxies to craft custom inputs that elicit informative responses. This attack is feasible when the system responds to unexpected or invalid requests with overly detailed output, allowing the adversary to gather information without breaching authentication barriers. The impact of a successful attack falls under the Confidentiality scope, enabling the adversary to read data they are not authorized to access. CAPEC rates the likelihood of attack as high and the typical severity as medium, since the extracted information often becomes the foundation for more damaging follow-on exploitation.",Confidentiality,Read Data,
CAPEC-121,Exploit Non-Production Interfaces,"In CAPEC-121, an adversary exploits a sample, demonstration, test, or debug interface that was unintentionally left enabled on a production system, with the goal of accessing information or functionality that should have been disabled in the operational device. Because non-production interfaces are often insecure by default and may not have undergone rigorous testing or hardened access controls, their presence on production hardware can allow an attacker to gain deep insight into system internals or invoke functions not intended for end-users. The attack begins with the adversary exploring the system to identify whether any non-production interface remains active; once found, the attacker leverages the interface to execute operations such as unauthorized commands, data access, or hardware manipulation that bypass protections. The prerequisite is that the production hardware contains debug/test/sample interfaces that have not been properly disabled or restricted. The attacker typically requires high skill due to the need to discover and manipulate these hidden interfaces, and resources may range from simple client applications or console windows to specific hardware or firmware tooling depending on the interface in question. If successful, the impacts include unauthorized access control bypass, privilege gain, execution of unauthorized commands, reading data, modifying data or altering execution logic, all of which undermine confidentiality, integrity, and access control mechanisms. The likelihood of attack is rated Low, while the typical severity is High.","Confidentiality, Access Control, Authentication, Authorization, Integrity","Gain Privileges, Bypass Protection Mechanism, Read Data, Execute Unauthorized Commands, Modify Data, Alter Execution Logic",
CAPEC-122,Privilege Abuse,"In CAPEC-122, an adversary abuses elevated functionality by exploiting system features or interfaces that are intended only for privileged users or administrators but are mistakenly exposed or insufficiently protected, allowing a lower-privileged entity to gain unauthorized capabilities. The attacker begins by surveying the target system to locate privileged operations, commands, or data paths that are incorrectly accessible, then experiments with invoking or interacting with this mis-exposed functionality. Once the method of access is understood, the attacker executes privileged operations or retrieves privileged information, thereby bypassing access-control protections and violating security boundaries. The consequences include breaches of confidentiality through unauthorized data access, violations of integrity through data modification, unauthorized command execution, privilege gain, and access-control bypass—effects that are especially critical when privileged resources such as control registers, debug interfaces, configuration fuses, or protected memory regions are exposed within hardware systems. CAPEC rates the likelihood of this attack as medium and the typical severity as high, reflecting the significant risk posed when privileged functionality is not adequately restricted.","Integrity, Confidentiality, Authorization, Access Control","Modify Data, Read Data, Execute Unauthorized Commands, Gain Privileges, Bypass Protection Mechanism",
CAPEC-124,Shared Resource Manipulation,"In CAPEC-124, an adversary exploits a resource that is shared among multiple applications, threads, or hardware functions — such as a single memory location, an application-pool data structure, or hardware pin multiplexing — to influence the behavior of other users of that resource without their knowledge. The attacker gains control (often by compromising one of the sharing applications or threads) over the shared resource and manipulates its content so that the other users continue to trust it and use the corrupted value in their operations. This manipulation can lead to invalid trust assumptions, corruption of additional data, unintended behavior in other components, or even crashes or compromise of the sharing applications or hardware functions. The prerequisites include: the target must expose a shared resource between multiple users (threads/applications/hardware functions) and the adversary must be able to co-opt one of those users so that the shared data can be manipulated and accepted by the others. No specialized resources are required by the attacker to perform the manipulation. The consequences span confidentiality and integrity risks (unauthorized data influence, corruption), as well as availability issues via crashes. The CAPEC entry assigns the typical severity as medium.",,,
CAPEC-148,Content Spoofing,"In CAPEC-148, an adversary modifies content so that it contains something other than what the original content producer intended, while keeping the apparent source of the content unchanged. The attacker may alter content at the source—such as changing a stored firmware image or hardware configuration file—or modify it in transit, intercepting and changing messages between components or modules. The prerequisites include the target system providing content that is insufficiently protected from modification and the adversary having the ability to alter that data or intercept the communication path. Medium skill is sufficient to craft the manipulated content and disguise the modification, and tools such as proxies or protocol analyzers may be used to facilitate the modifications. When executed in a hardware context, content spoofing can lead to unauthorized control of device behavior, exposure of sensitive data, or inducement of unintended operational states. The scope falls under confidentiality and integrity, because an adversary might cause incorrect content to be used or disclosed; the likelihood of attack is rated medium and the typical severity is rated medium.",Integrity,Modify Data,
CAPEC-150,"
Collect Data from Common Resource Locations","In CAPEC-150, an adversary leverages knowledge of well-known or default resource locations on a system—such as files, directories, memory segments, or hardware registers placed at standard addresses—and retrieves data from these locations in order to undermine target security. Even when the exact location of the resource is not known, naming conventions or default address mappings indicate likely areas of the system, enabling the attacker to search effectively. The prerequisites include a system that employs default resource placement or naming conventions and the adversary’s ability to access those locations (which may not require prior direct access). Resources required are minimal—no specialized tools are necessary. When applied to hardware environments, this might involve accessing known memory-mapped I/O registers, configuration memory in embedded systems, or other default hardware resource locations where sensitive data resides. The typical severity is rated as Medium.",,,
CAPEC-151,Identity Spoofing,"In CAPEC-151, an adversary assumes (i.e., takes on) the identity of another entity—human or non-human—and uses that identity to accomplish an objective. The attacker may craft messages, commands, or interactions that appear to originate from a legitimate identity or steal/spoof authentication credentials associated with that identity. In the hardware domain, this might involve faking the identity of a trusted component, device, or subsystem so that the target system accepts commands or data as though they came from a legitimate source. The prerequisites for this attack include the presence of identifiers or credentials that can be impersonated, as well as means for the adversary to generate or present proof of the spoofed identity. Resources needed include tools or interfaces for message crafting, protocol manipulation, or credential theft. If successful, the attack allows the adversary to bypass authentication, assume privileges, or perform unauthorized operations under the guise of a trusted identity—thereby affecting confidentiality, integrity, and access control.","Confidentiality, Integrity, Authentication, Access Control",Gain Privileges,
CAPEC-154,Resource Location Spoofing,"In CAPEC-154, an adversary deceives a system or user into requesting or using a resource from an unintended location or source, thereby substituting a malicious or attacker-controlled resource for the intended one. The attacker begins by investigating how the target locates its resources (e.g., firmware images, hardware libraries, configuration files, or memory-mapped resources) and identifies how location references or paths can be manipulated or spoofed. Then the adversary crafts or tricks the target into redirecting resource look-ups or retrieval requests to the bogus location, causing the system to load or use compromised content. This attack is feasible when the target allows resource references to be altered or fails to sufficiently validate the origin or path of the resource. If successful, the impact can span confidentiality (exposing or redirecting data) and integrity (using tampered resources to alter system behavior), enabling the attacker to hijack system functions or introduce malicious logic. The likelihood is considered medium, and the typical severity is rated as medium.",Authorization,Execute Unauthorized Commands,
CAPEC-161,Infrastructure Manipulation,"In CAPEC-161, an adversary exploits characteristics of the infrastructure of a network entity to manipulate how information flows between system components, most often by altering the routing of network messages so they are redirected away from their proper destination and instead sent to an attacker-controlled location. The victim remains unaware that their messages are being misdirected or intercepted. The attack typically begins with the adversary exploring the target’s infrastructure to understand how traffic is routed, followed by experimentation to determine how routing behavior can be influenced, and finally exploitation to redirect messages for information gathering or further attack. This is feasible when the target system’s infrastructure allows an adversary to modify routing or influence message paths, enabling interception or redirection. Required resources depend on the nature of the infrastructure but generally involve access to the network entity being manipulated. The consequences fall under the Confidentiality scope, allowing an adversary to Read Data, and under Integrity, enabling Modify Data in transit. CAPEC rates the likelihood of attack as Medium and the typical severity as High due to the potential for covert interception or manipulation of information flows.",,,
CAPEC-166,Force the System to Reset Values,"In CAPEC-166, an adversary forces the system to reset configuration or operational values to a previous state so as to exploit weaknesses that depend on that prior state or configuration. Even when the attacker cannot directly set the configuration, the presence of a reset function—used to recover ‎a system to a known good or stable state—can be abused because it is often less strictly secured. By triggering such a reset, the attacker may restore the system into an insecure configuration, disable protections, or modify access controls, thereby opening doors to misuse or compromise. The prerequisites are that the system implements a reset or rollback function, and that function is not adequately protected from adversary-initiated invocation. The attacker’s skill requirement is unspecified (but implicitly non-specialized in the entry), and the resources required are minimal since the reset mechanism is built-in. The consequences include enabling undesired functionality, disabling services, or modifying access controls, with CAPEC rating the likelihood of attack as High and the typical severity as Medium.",,,
CAPEC-176,Configuration/Environment Manipulation,"In CAPEC-176, an adversary manipulates configuration or environment settings external to a device or application—such as firmware configuration files, hardware control registers, or external libraries and settings—which the target system consults during execution and which influence system behavior. The attack begins when the system relies on external configuration controls and the adversary obtains sufficient access to alter the relevant files, settings, or environment items. With this access, the attacker modifies the configuration or environment so that, when the system executes, it uses the tampered settings and behaves in an unintended or unsafe manner. This pattern applies equally in hardware contexts when external configuration registers or environment-settings influence hardware behavior, such that altering those settings causes misuse of hardware functions. A successful attack enables unintended behavior, misconfiguration, or enabling of insecure modes, and the typical severity is rated as Medium. The prerequisites are that the device must use external configuration controls and the adversary must have access to change those environment items.",,,
CAPEC-180,Exploiting Incorrectly Configured Access Control Security Levels,"In CAPEC-180, an adversary exploits weaknesses in how access control security levels are configured, allowing them to bypass intended protections and gain unauthorized access to system functions, data, or restricted operations. Although access controls are present, their configuration is incorrect—either granting too little protection to sensitive functionality or applying overly restrictive rules that can be abused to cause denial of service or disrupt legitimate behavior. The attacker begins by surveying the system, often as an authenticated or unauthenticated user, to enumerate functions, interfaces, or data paths protected by access control and then probes these protections to identify misconfigurations. By attempting authenticated, unauthenticated, indirect, or side-channel access to targeted functions or data, the attacker detects which access control rules fail to enforce the intended restrictions. Once identified, the adversary exploits these weaknesses to execute unauthorized commands, gain privileges, read or modify data, bypass protection mechanisms, or induce unreliable execution. The prerequisites are that access controls exist but are incorrectly configured in a way that results in either insufficient or overly restrictive enforcement. This attack requires low skill, because the adversary only needs to observe how access mechanisms are invoked and attempt to access those mechanisms directly, and no specialized resources are required. CAPEC rates the likelihood of attack as High and the typical severity as Medium, with impacts spanning Confidentiality (Read Data), Integrity (Modify Data), Authorization (Gain Privileges, Execute Unauthorized Commands), Access Control (Bypass Protection Mechanism), and Availability (Unreliable Execution).","Integrity, Confidentiality,  Authorization, Access Control, Availability","Modify Data, Read Data, Execute Unauthorized Commands, Gain Privileges, Bypass Protection Mechanism, Unreliable Execution",
CAPEC-188,"
Reverse Engineering","In CAPEC-188, an adversary uses a range of analysis techniques to discover the structure, function, and composition of an object, resource, or system—such as hardware components, embedded devices, firmware, or software—so as to determine how it was built or how it operates, with the ultimate goal of duplicating or replicating some aspect of its functionality. The attacker begins by examining the target system, reverse-engineering its design or behavior, then proceeds to derive knowledge about its operation, build a clone or replicate a subsystem, or extract hidden logic or secrets. When applied in a hardware context, this may include analyzing mechanical or electronic components, reading chip layouts, extracting firmware, or interpreting device behavior. The likelihood of attack is rated Low and the typical severity is Low.",,,
