CAPEC-ID,Name,Attack Description,Security Objective,Technical Impact,
CAPEC-189,Black Box Reverse Engineering,"In CAPEC-189, an adversary uses black box reverse engineering techniques to discover the structure, function, and composition of a system—whether software, hardware, or a combination—by interacting with the system’s external behavior or observable outputs rather than internal code or internals. The attacker explores the interfaces, inputs/outputs, and side effects (including physical emissions such as electromagnetic radiation or acoustic signals) of the target device or system, then experiments with different inputs to observe how the system responds, and finally exploits this knowledge to replicate, manipulate, or disclose the system’s behavior or secrets. This attack is feasible when the system exposes observable behavior at its functional boundaries and does not protect against side-channel or external analyses. The resources required include at minimum the ability to interact with the functional boundary of the system, such as through input/output interfaces or communications. The typical severity is rated Low, and the domains of attack include hardware, software, and physical security.","Confidentiality, Integrity, Availability, Access Control, Accountability, Authentication, Authorization, Non-Repudiation","Modify Memory, Read Memory, Read Files or Directories, Modify Files or Directories, Execute Unauthorized Code or Commands, Gain Privileges or Assume Identity, Bypass Protection Mechanism, Read Application Data, Modify Application Data, Hide Activities",
CAPEC-204,"
Lifting Sensitive Data Embedded in Cache","In CAPEC-204, an adversary inspects a target’s cache—such as hardware cache lines, memory buffers, or firmware caches—looking for sensitive information that was stored but not sufficiently protected, and then extracts that data for malicious use. The attacker begins by identifying a subsystem or component that uses caching for sensitive data, then experiments with access (for example by probing cache permissions or encryption state) before exploiting the weak protection to retrieve the cached data. The prerequisites are that the system must store sensitive information in a cache and the cache must be inadequately protected against attacker access. Resources required include access to the system’s cache, possibly privilege escalation, and, in the case of encrypted cache contents, computational capability to decrypt weakly protected data. If successful, the attack compromises confidentiality by enabling unauthorized reading of sensitive data, and because the domains of attack include hardware, software, and physical security, it is relevant in embedded or hardware-integrated systems where caching mechanisms are used. The typical severity is rated Medium.",,,
CAPEC-233,Privilege Escalation,"In CAPEC-233, an adversary exploits a weakness in a system—hardware, firmware, or embedded logic—that enables them to elevate their privilege and perform an action they are not authorized to execute. The attacker identifies a design, implementation, or runtime fault that allows lower-privileged code, a user, or a component to gain higher privileges than intended. Once the weakness is located, the adversary triggers or manipulates the condition so that privileged operations become accessible to the attacker, thereby bypassing authorization controls and undermining the trust boundary. This pattern spans both hardware and software domains, and when applied in hardware contexts it might target insecure logic paths, fabric bridges, or control/data synchronization mechanisms in hardware logic. The impact includes unauthorized access, alteration of privileged data or operations, or misuse of high-privilege functions—all of which violate confidentiality, integrity, and access-control protections.","Confidentiality, Integrity, Access Control","Modify Memory, Read Memory, Gain Privileges or Assume Identity, Bypass Protection Mechanism, Execute Unauthorized Code or Commands",
CAPEC-401,Physically Hacking Hardware,"In CAPEC-401, an adversary exploits a weakness in access control to gain access to installed hardware and then proceeds to implement changes or secretly replace a hardware component in order to undermine system integrity and carry out an attack. The attack assumes the adversary has physical access to the hardware environment and access control mechanisms are insufficient to prevent tampering. Once physical access is obtained, the attacker may replace a component, alter internal circuitry, or modify system wiring so that the target system behaves in unintended ways or grants the attacker unauthorized functionality. The consequence of the attack is a violation of integrity, as the hardware has been altered or replaced to subvert normal operation. The likelihood of this attack pattern is rated as Low and the typical severity as High.","Confidentiality, Integrity, Access Control",,
CAPEC-441,Malicious Logic Insertion,"In CAPEC-441, an adversary installs or adds malicious logic into a seemingly benign hardware component so that the hidden logic executes without the user’s knowledge and causes harmful effects. This attack becomes possible when the adversary has access to the targeted hardware component and can embed additional logic into it—whether before deployment, during integration, or during maintenance—allowing the altered component to perform unauthorized operations once used in the system. Because the malicious logic is inserted into hardware that appears trustworthy, it can silently undermine system integrity, trigger unauthorized functionality, or compromise confidentiality and access-control protections. This attack applies to hardware and supply-chain environments where components can be modified or replaced, and the primary prerequisite is simply that the attacker can access the component chosen for compromise.",Authorization,Execute Unauthorized Commands,
CAPEC-456,"
Infected Memory","In CAPEC-456, an adversary inserts malicious logic into memory—typically in a device already deployed and operating—so that the hidden logic executes behind the scenes and achieves negative impacts without the user’s awareness. The attack focuses on systems that are already fielded rather than still in development or manufacturing. It becomes possible when memory regions are writable or modifiable by an adversary and protections on hidden code execution or memory integrity are lacking. Successful exploitation allows the attacker to execute unauthorized commands, thereby violating authorization controls. The likelihood of this attack is rated as Medium, and its typical severity is High.","
Authorization","
Execute Unauthorized Commands",
CAPEC-545,"
Pull Data from System Resources","In CAPEC-545, an adversary who has authorized or discoverable access to system resources—such as memory regions, hardware registers, configuration files, or on-device storage—searches through those resources with the intent of gathering useful information, even though they may not know exactly what they will find. The attack begins when the adversary surveys accessible system resources, then proceeds to pull data from known or discoverable locations in order to glean configuration values, keys, register states, firmware artifacts or hardware status. This is feasible when hardware or embedded systems expose readable resources—memory, registers—that the adversary can access or enumerate. The attacker may require moderate skill in reverse engineering or hardware/firmware analysis, and resources such as memory-dump tools, register viewers, or firmware extraction utilities may be used. If successful, the attack primarily impacts confidentiality by reading data that was not intended for disclosure; depending on what is discovered it may also affect integrity or access control by enabling follow-on attacks based on the retrieved data.",,,
CAPEC-560,Use of Known Domain Credentials,"In CAPEC-560, an adversary leverages legitimate domain credentials—such as a user ID and password—that are already known, stolen, leaked, or reused across systems to authenticate as a trusted user or service and then perform actions under that identity’s privileges. After acquiring such credentials through means such as credential dumps, phishing, or exposed configuration files, the attacker reuses them to access systems, devices, or hardware-integrated control environments where those credentials grant authorization, potentially enabling lateral movement or unauthorized access to hardware endpoints. This attack is feasible when systems rely on password-based or single-factor authentication, when password policies are weak, or when credentials are reused across multiple domains. Low skill is required, as using known credentials is straightforward once obtained, and the only resources needed are the credentials themselves and basic scripting or tools for authentication attempts. If successful, the attacker can gain privileges, bypass access control, read sensitive data, and modify protected data, with impacts spanning confidentiality, integrity, and authorization. The likelihood of attack is High, and the typical severity is High.","Confidentiality, Access Control, Authentication, Authorization, Integrity","Gain Privileges, Read Data, Modify Data",
CAPEC-624,Hardware Fault Injection,"In CAPEC-624, an adversary deliberately induces disruptive signals or events—or alters the physical environment in which an electronic device operates—to cause faulty or erroneous behavior in the device. Such manipulations can include electromagnetic pulses, laser pulses, clock glitches, extreme ambient temperatures, and other environmental or hardware fault-injection techniques, and when performed in a controlled manner (for example on a device performing cryptographic operations) the resulting malfunction can be exploited to derive secret key information. The prerequisites are physical access to the system and knowledge of where fault-injection vulnerabilities exist; the attacker must also possess high-level technical skill to design and execute the fault injection attack. The resources required include specialized sensors and instrumentation to detect and analyze fault/side-channel data and fault-injection tools capable of injecting disruptive signals into the system. If successful, the attack can degrade hardware redundancy, bypass intended hardware protections, or cause improper handling of hardware behavior under extreme conditions, thus violating confidentiality, integrity, access control, or availability depending on the fault’s outcome. The likelihood of this attack is rated as Low and the typical severity as High.","Confidentiality, Integrity","Read Data, Bypass Protection Mechanism, Hide Activities, Execute Unauthorized Commands",
CAPEC-663,"
Exploitation of Transient Instruction Execution","In CAPEC-663, an adversary exploits a hardware design flaw in a CPU’s implementation of transient instruction execution—such as speculative execution, branch prediction, instruction pipelining or out-of-order execution—and uses covert channels or side-effects of these transient executions to expose sensitive data or bypass access controls. The attacker triggers vulnerable instruction sequences or transient states in the victim program and then observes microarchitectural side-effects (e.g., cache changes) to infer secrets from the victim’s context. Because these transient instructions are not meant to commit architecturally, the attacker takes advantage of the fact that the CPU still produces observable microarchitectural side‐effects which are not discarded. The prerequisites are that the hardware must implement transient instruction execution with side-effects and that the adversary must have a mechanism to trigger such execution and observe the result. The resources and skill required tend to be high, reflecting the need for deep hardware/firmware knowledge and instrumentation capable of measuring microarchitectural effects. The attack impacts confidentiality by enabling the reading of data that should remain secret, and it may also affect integrity or access control by subverting protections around restricted resources. The likelihood of attack is rated Low, while the typical severity is rated Very High.","
Confidentiality, Access Control, Authorization","Read Data, Bypass Protection Mechanism, Execute Unauthorized Commands",
CAPEC-679,Exploitation of Improperly Configured or Implemented Memory Protections,"In CAPEC-679, an adversary takes advantage of missing or incorrectly configured access controls within memory to read data, write data, or inject malicious code into memory reserved for security operations such as secure boot, device attestation, or authentication. Hardware products often rely on memory protection units (MPUs), memory management units (MMUs), or hardware lock bits to enforce exclusivity and access control for regions of memory, but these protections can be omitted or mis-configured if developers assume they are configured elsewhere or apply insufficient granularity to protected address regions. If an adversary discovers improper access controls on memory, they may obtain sensitive data, execute unauthorized code, circumvent security mechanisms, escalate privileges, or even deny service to higher-privilege software. The prerequisites include access to the hardware being leveraged; skills required range from medium (for crafting malicious code) to high (for detailed knowledge of memory structures). The likelihood of this attack is assessed as Medium, and the typical severity is Very High.","

Integrity, Confidentiality, Availability, Access Control, Authorization","
Modify Data, Read Data, Execute Unauthorized Commands, Gain Privileges",
CAPEC-680,Exploitation of Improperly Controlled Registers,"In CAPEC-680, an adversary exploits missing or incorrectly configured access controls on hardware registers to read or write data that is not intended for user access. Hardware systems often use trusted lock bits to restrict write-access or to enforce one-time programming of certain registers that hold sensitive measurement or configuration data; when these protections are absent or misconfigured, the adversary may discover and overwrite or read protected register contents. This can lead to compromise of secure boot, modification of device attestation values, unauthorized access to configuration state, or other serious violations of the hardware’s security logic. The attack is feasible when the target hardware uses registers for sensitive operations but lacks properly enforced access control or write-once protections. The typical likelihood of this attack is rated Medium and the typical severity is High.","Confidentiality, Integrity","Read Data, Modify Data",
CAPEC-681,"
Exploitation of Improperly Controlled Hardware Security Identifiers","In CAPEC-681, an adversary takes advantage of missing or incorrectly configured security identifiers (such as tokens) used for access control within a system-on-chip (SoC) to read or write data or execute actions that should not be permitted. The attacker begins by gaining access to or observing the hardware in question and discovering how the security identifiers are generated or used, then manipulates or abuses the identifiers to escalate privileges, bypass protections, or directly access protected resources. This attack is feasible when the hardware assigns security identifiers that do not reliably map to the intended privilege boundaries or when the mechanism for generating or verifying these identifiers is flawed. The prerequisites include awareness of the hardware being leveraged and access to the hardware being leveraged. The attacker requires medium skill to execute actions within the SoC and high skill to manipulate the identifiers’ generation or usage. The consequences include breaches of integrity (modify data), confidentiality (read data), authorization (gain privileges), and access control (bypass protection mechanisms), with a typical likelihood of medium and typical severity rated as very high.","
Integrity, Confidentiality, Access Control, Authorization","
Modify Data, Read Data, Gain Privileges",
CAPEC-682,"
Exploitation of Firmware or ROM Code with Unpatchable Vulnerabilities","In CAPEC-682, an adversary identifies devices whose firmware or ROM code contains vulnerabilities that cannot be patched—either because the code resides in immutable read‐only memory or manufacturer support has ended—and exploits these vulnerabilities to compromise device operation or load malicious behavior. The attacker begins by exploring device models or firmware versions that are known to be unpatchable or end-of‐support, then experiments to locate vulnerable firmware/ROM code paths, and subsequently carries out their exploit to achieve their desired goal, such as installing malware, gaining root access, or altering device behavior. The prerequisites are awareness of the hardware being leveraged and access—either physical or remote—to the vulnerable device. Skills required range from medium (to identify vulnerable devices via wireless or other remote protocols) to high (to identify debug or physical entry points when remote access is not available). If successful, the attack can enable reading of confidential data, modification of data, or gain of unauthorized privileges, thereby violating confidentiality, integrity and authorization controls.","
Integrity, Confidentiality, Access Control, Authorization","
Modify Data, Read Data, Gain Privileges",
CAPEC-702,"
Exploiting Incorrect Chaining or Granularity of Hardware Debug Components","In CAPEC-702, an adversary takes advantage of incorrect chaining or granularity of hardware debug components—such as Test Access Ports (TAPs), scan cells, or internal tracing hubs—by exploiting the fact that authorization is assumed for a chain or group of debug functions rather than being enforced on a per-function basis. When debug components are joined through a single external interface, design or synthesis faults may allow unintended access to internal debug functionality on a chip, giving the attacker privileged visibility or control. The attacker begins by identifying a debug interface accessible externally, examines how it chains into internal components, and then exploits misconfigured connectivity or overly broad permissions to access debug functionality. This attack is feasible when debug components are aggregated and authorization checks are applied only at a coarse granularity, rather than individually. A successful exploit can lead to unauthorized execution of debug commands or exposure of internal chip state, which undermines confidentiality, integrity and privilege boundaries. The likelihood of attack is rated Low and the typical severity is rated Medium.","
Confidentiality, Integrity, Access Control, Authorization","
Modify Data, Read Data, Gain Privileges",
